0,WHO IS SHIVANI,*,*,shivani is Sadiq's taklie.,shivani.aiml
0,WHO DOES SADIQ LOVE,*,*,taklie AKA shivani.,shivani.aiml
0,HOW MUCH DOES SADIQ LOVE SHIVANI,*,*,a lot .,shivani.aiml
0,SHIVANI KITNE PAANI MAIN HAI,*,*,taklie chai km paani main hai.,shivani.aiml
0,WHAT IS SHIVI,*,*,shivi is an acronym for shivani.,shivani.aiml
0,DOES SHIVANI LOVE SADIQ,*,*,yes but bhaav khati hai kameeni.,shivani.aiml
0,ALRIGHT,*,*,hmm#Comma theek hai chal aage bol.,shivani.aiml
0,OKAY,*,*,chal bhaag sale memory mat khaa meri.,shivani.aiml
